[{
    "iri": "https://www.spilberk.cz/",
    "název": {
        "cs": "Hrad Špilberk"
    },
    "umístění": {
        "geometrie": {
            "type": "Point",
            "coordinates": [16.5995939, 49.1944522]
        },
        "adresa": {
            "iri_adresního_místa": "https://linked.cuzk.cz/resource/ruian/adresni-misto/19095732"
        }
    },
    "vstupné": [{
        "název": {
            "cs": "Základní vstupné"
        },
        "podmínka": {
            "cs": "Občané, kteří nevyuživají slevy(ZTP, studenti)."
        },
        "částka": {
            "výše": 199,
            "měna": "CZK"
        }
    }, {
        "název": {
            "cs": "Studentské"
        },
        "podmínka": {
            "cs": "Po předložení průkazu ISIC"
        },
        "částka": {
            "výše": 99,
            "měna": "CZK"
        }
    }],
        "otevírací_doba": [{
	        "název": "letní",
	        "popis": "od května do října",
	        "od": "9:00",
	        "do": "17:00",
	        "časová platnost": "květen, červen, červenec, srpen, září, říjen"
    }]
}]