[{
    "iri": "https://www.spilberk.cz/",
    "název": {
        "cs": "Hrad Špilberk",
        "en": "Špilberk Castle"
    },
    "umístění": {
        "geometrie": {
            "type": "Point",
            "coordinates": [16.5995939, 49.1944522]
        },
        "adresa": {
            "iri_adresního_místa": "https://linked.cuzk.cz/resource/ruian/adresni-misto/19095732"
        }
    },
    "vstupné": [{
        "název": {
            "cs": "Základní vstupné",
            "en": "Basic admission"
        },
        "podmínka": {
            "cs": "Občané, kteří nevyuživají slevy(ZTP, studenti).",
            "en": "People who don´t benefit from discounts (students, ...)."
        },
        "částka": {
            "výše": 199,
            "měna": "CZK"
        }
    }, {
        "název": {
            "cs": "Studentské",
            "en": "Student"
        },
        "podmínka": {
            "cs": "Po předložení průkazu ISIC.",
            "en": "Valid after presenting the ISIC card."
        },
        "částka": {
            "výše": 99,
            "měna": "CZK"
        }
    }],
    "otevírací_doba": [{
        "název": {
            "cs": "Letní otevírací doba",
            "en": "Summer opening hours"
        },
        "popis": {
            "cs": "Letní otevírací doba platí vždy od 1.5. do 31.10.",
            "en": "Summer opening hours begins on the 1st May and lasts till 31st of October."
        },
        "od": "2018-05-01",
        "do": "2019-10-31",
        "čas": [{
            "začátek": {
                "čas": "08:00:00"
            },
            "konec": {
                "čas": "12:00:00"
            }
        }, {
            "začátek": {
                "čas": "12:30:00"
            },
            "konec": {
                "čas": "17:30:00"
            }
        }],
        "den-v-týdnu": [{
            "iri": "https://data.mvcr.gov.cz/zdroj/číselníky/dny-v-týdnu/položky/úterý",
            "iri": "https://data.mvcr.gov.cz/zdroj/číselníky/dny-v-týdnu/položky/středa",
            "iri": "https://data.mvcr.gov.cz/zdroj/číselníky/dny-v-týdnu/položky/čtvrtek", 
            "iri": "https://data.mvcr.gov.cz/zdroj/číselníky/dny-v-týdnu/položky/pátek"  
        }] 
    }]
}]